{
  "model_name": "o4-mini",
  "model_organization": "OpenAI",
  "submitting_organization": "Sierra",
  "submission_date": "2025-06-09",
  "contact_info": {
    "email": "victor@sierra.ai, ben.s@sierra.ai",
    "name": "Sierra Research Team"
  },
  "is_new": false,
  "trajectories_available": true,
  "references": [
    {
      "title": "τ²-Bench: Evaluating Conversational Agents in a Dual-Control Environment",
      "url": "https://arxiv.org/abs/2506.07982",
      "type": "paper"
    }
  ],
  "results": {
    "retail": {
      "pass_1": 68.3,
      "pass_2": 58.7,
      "pass_3": 52.1,
      "pass_4": 46.8
    },
    "airline": {
      "pass_1": 52.1,
      "pass_2": 44.2,
      "pass_3": 38.9,
      "pass_4": 34.7
    },
    "telecom": {
      "pass_1": 50.2,
      "pass_2": 42.1,
      "pass_3": 36.8,
      "pass_4": 32.4
    }
  },
  "methodology": {
    "evaluation_date": "2025-06-09",
    "tau2_bench_version": "0.1.3",
    "user_simulator": "gpt-4.1-2025-04-14",
    "notes": "Original evaluation from tau2-bench paper",
    "verification": {
      "modified_prompts": false,
      "omitted_questions": false,
      "details": "Verified evaluation with full trajectory data available"
    }
  }
}