{
  "model_name": "Example-Model-v2.0",
  "model_organization": "Example Organization",
  "submitting_organization": "Example Organization",
  "submission_date": "2025-01-15",
  "contact_info": {
    "email": "research@example.com",
    "name": "Research Team",
    "github": "example-org"
  },
  "is_new": true,
  "trajectories_available": false,
  "references": [
    {
      "title": "Example Model Paper (arXiv preprint)",
      "url": "https://arxiv.org/abs/2401.00000",
      "type": "paper"
    },
    {
      "title": "Example Model GitHub Repository",
      "url": "https://github.com/example-org/example-model",
      "type": "github"
    },
    {
      "title": "Example Model on Hugging Face",
      "url": "https://huggingface.co/example-org/example-model",
      "type": "huggingface"
    }
  ],
  "results": {
    "retail": {
      "pass_1": 78.5,
      "pass_2": 72.1,
      "pass_3": 67.8,
      "pass_4": 64.2
    },
    "airline": {
      "pass_1": 61.2,
      "pass_2": 55.8,
      "pass_3": 51.4,
      "pass_4": 47.9
    },
    "telecom": {
      "pass_1": 45.6,
      "pass_2": null,
      "pass_3": null,
      "pass_4": null
    }
  },
  "methodology": {
    "evaluation_date": "2025-01-10",
    "tau2_bench_version": "v2.0",
    "notes": "Example submission showing complete evaluation on retail and airline domains, partial evaluation on telecom (Pass@1 only)",
    "verification": {
      "modified_prompts": false,
      "omitted_questions": true,
      "details": "Example template - partial evaluation on telecom domain"
    }
  }
}
